<?xml version="1.0" encoding="utf-8"?>
<!DOCTYPE VYDANI SYSTEM "vydani.dtd">
<VYDANI>
	<IDENTIFIKACE-ZPRAVY>
		<ZASLAL>27867102</ZASLAL>
		<CISLO-ZPRAVY>717443</CISLO-ZPRAVY>
		<NAZEV-DOKUMENTU KOD="Vydání-výskytu-výkazu"></NAZEV-DOKUMENTU>
		<METODIKA>MKT20130101.01</METODIKA>
		<FUNKCE-ZPRAVY KOD="Testovací"></FUNKCE-ZPRAVY>
		<DATUM>20130509</DATUM>
	</IDENTIFIKACE-ZPRAVY>
	<ADRESA STRANA="Odesílatel">
		<KOD-SUBJEKTU>27867102</KOD-SUBJEKTU>
		<NAZEV-SUBJEKTU>X-TRADE BROKERS DOM MAKLERSKI SPóŁKA AKCYJNA, organizační složka</NAZEV-SUBJEKTU>
		<MESTO>Praha 8</MESTO>
		<PSC>180 00</PSC>
		<ULICE>Pobřežní 12</ULICE>
		<KONTAKT KOD-FUNKCE="Osoba-odpovědná-za-obsah">
			<JMENO-OSOBY>Tomáš Drábek</JMENO-OSOBY>
			<SPOJENI TYP="Telefon">226 259 930-930</SPOJENI>
			<SPOJENI TYP="Fax">226259903-903</SPOJENI>
		</KONTAKT>
	</ADRESA>
	<IDENTIFIKACE-VYKAZU>
		<DATOVY-SOUBOR>MOKAS42.04.00</DATOVY-SOUBOR>
		<VYSKYT>
			<SUBJEKT>27867102</SUBJEKT>
			<ROZSAH-SUBJEKTU>S_BCPZB</ROZSAH-SUBJEKTU>
			<STAV-KE-DNI>20130228</STAV-KE-DNI>
		</VYSKYT>
		<STATUS KOD="Nová-data"></STATUS>
		<DUVOD KOD="Na-základě-metodiky"></DUVOD>
		<AUDIT KOD="Data-před-auditem"></AUDIT>
	</IDENTIFIKACE-VYKAZU>
	<DATA>
		<DATOVA-OBLAST KOD="MOKA42_11">
			<RADEK PORADI="1">
				<SLOUPEC PORADI="1">x</SLOUPEC>
				<SLOUPEC PORADI="2">AED</SLOUPEC>
				<SLOUPEC PORADI="3">02</SLOUPEC>
				<SLOUPEC PORADI="4">x</SLOUPEC>
				<SLOUPEC PORADI="5">x</SLOUPEC>
				<SLOUPEC PORADI="6">x</SLOUPEC>
				<SLOUPEC PORADI="7">x</SLOUPEC>
				<SLOUPEC PORADI="8">x</SLOUPEC>
				<SLOUPEC PORADI="9">x</SLOUPEC>
				<SLOUPEC PORADI="10">x</SLOUPEC>
				<SLOUPEC PORADI="11">x</SLOUPEC>
				<SLOUPEC PORADI="12">x</SLOUPEC>
				<SLOUPEC PORADI="13">x</SLOUPEC>
				<SLOUPEC PORADI="14">x</SLOUPEC>
				<SLOUPEC PORADI="15">x</SLOUPEC>
				<SLOUPEC PORADI="16">x</SLOUPEC>
				<SLOUPEC PORADI="17">x</SLOUPEC>
				<SLOUPEC PORADI="18">x</SLOUPEC>
				<SLOUPEC PORADI="19">x</SLOUPEC>
				<SLOUPEC PORADI="20">x</SLOUPEC>
				<SLOUPEC PORADI="21">x</SLOUPEC>
				<SLOUPEC PORADI="22">x</SLOUPEC>
				<SLOUPEC PORADI="23">x</SLOUPEC>
				<SLOUPEC PORADI="24">x</SLOUPEC>
				<SLOUPEC PORADI="25">x</SLOUPEC>
				<SLOUPEC PORADI="26">x</SLOUPEC>
				<SLOUPEC PORADI="27">x</SLOUPEC>
				<SLOUPEC PORADI="28">x</SLOUPEC>
				<SLOUPEC PORADI="29">x</SLOUPEC>
				<SLOUPEC PORADI="30">x</SLOUPEC>
			</RADEK>
		</DATOVA-OBLAST>
	</DATA>
</VYDANI>
