<?xml version="1.0" encoding="utf-8"?>
<!DOCTYPE VYDANI SYSTEM "vydani.dtd">
<VYDANI>
	<IDENTIFIKACE-ZPRAVY>
		<ZASLAL>27867102</ZASLAL>
		<CISLO-ZPRAVY>795781</CISLO-ZPRAVY>
		<NAZEV-DOKUMENTU KOD="Vydání-výskytu-výkazu"></NAZEV-DOKUMENTU>
		<METODIKA>MKT20130101.01</METODIKA>
		<FUNKCE-ZPRAVY KOD="Testovací"></FUNKCE-ZPRAVY>
		<DATUM>20140107</DATUM>
	</IDENTIFIKACE-ZPRAVY>
	<ADRESA STRANA="Odesílatel">
		<KOD-SUBJEKTU>27867102</KOD-SUBJEKTU>
		<NAZEV-SUBJEKTU>X-TRADE BROKERS DOM MAKLERSKI SPóŁKA AKCYJNA, organizační složka</NAZEV-SUBJEKTU>
		<MESTO>Praha 8</MESTO>
		<PSC>180 00</PSC>
		<ULICE>Pobřežní 12</ULICE>
		<KONTAKT KOD-FUNKCE="Osoba-odpovědná-za-obsah">
			<JMENO-OSOBY>Tomáš Drábek</JMENO-OSOBY>
			<SPOJENI TYP="Telefon">226 259 930-930</SPOJENI>
			<SPOJENI TYP="Fax">226259903-903</SPOJENI>
		</KONTAKT>
	</ADRESA>
	<IDENTIFIKACE-VYKAZU>
		<DATOVY-SOUBOR>MOKAS41.04.00</DATOVY-SOUBOR>
		<VYSKYT>
			<SUBJEKT>27867102</SUBJEKT>
			<ROZSAH-SUBJEKTU>S_BCPZB</ROZSAH-SUBJEKTU>
			<STAV-KE-DNI>20130831</STAV-KE-DNI>
		</VYSKYT>
		<STATUS KOD="Nová-data"></STATUS>
		<DUVOD KOD="Na-základě-metodiky"></DUVOD>
		<AUDIT KOD="Data-před-auditem"></AUDIT>
	</IDENTIFIKACE-VYKAZU>
	<DATA>
		<DATOVA-OBLAST KOD="MOKA41_11">
<RADEK PORADI="1">																	
	<SLOUPEC PORADI="1">130842000001</SLOUPEC>	<SLOUPEC PORADI="2">USD</SLOUPEC>	<SLOUPEC PORADI="3">04</SLOUPEC>	<SLOUPEC PORADI="4">04</SLOUPEC>	<SLOUPEC PORADI="5">I</SLOUPEC>	<SLOUPEC PORADI="6">2013-08-01</SLOUPEC>	<SLOUPEC PORADI="7">00:00:06</SLOUPEC>	<SLOUPEC PORADI="8">205628510C100000</SLOUPEC>	<SLOUPEC PORADI="10">6402180807</SLOUPEC>	<SLOUPEC PORADI="11">6402180807</SLOUPEC>	<SLOUPEC PORADI="13">TRBDCZP1XXX-GBPUSD</SLOUPEC>	<SLOUPEC PORADI="14">S</SLOUPEC>	<SLOUPEC PORADI="18">0.20000</SLOUPEC>	<SLOUPEC PORADI="19">K</SLOUPEC>	<SLOUPEC PORADI="33">N</SLOUPEC>	<SLOUPEC PORADI="34">N</SLOUPEC>	<SLOUPEC PORADI="39">DIRECT</SLOUPEC>
</RADEK>																	
<RADEK PORADI="2">																	
	<SLOUPEC PORADI="1">130842000002</SLOUPEC>	<SLOUPEC PORADI="2">CHF</SLOUPEC>	<SLOUPEC PORADI="3">04</SLOUPEC>	<SLOUPEC PORADI="4">04</SLOUPEC>	<SLOUPEC PORADI="5">I</SLOUPEC>	<SLOUPEC PORADI="6">2013-08-01</SLOUPEC>	<SLOUPEC PORADI="7">00:00:10</SLOUPEC>	<SLOUPEC PORADI="8">205639330O100000</SLOUPEC>	<SLOUPEC PORADI="10">8005298180</SLOUPEC>	<SLOUPEC PORADI="11">8005298180</SLOUPEC>	<SLOUPEC PORADI="13">TRBDCZP1XXX-USDCHF</SLOUPEC>	<SLOUPEC PORADI="14">S</SLOUPEC>	<SLOUPEC PORADI="18">0.10000</SLOUPEC>	<SLOUPEC PORADI="19">K</SLOUPEC>	<SLOUPEC PORADI="33">N</SLOUPEC>	<SLOUPEC PORADI="34">N</SLOUPEC>	<SLOUPEC PORADI="39">DIRECT</SLOUPEC>
</RADEK>																	
<RADEK PORADI="3">																	
	<SLOUPEC PORADI="1">130842000003</SLOUPEC>	<SLOUPEC PORADI="2">USD</SLOUPEC>	<SLOUPEC PORADI="3">04</SLOUPEC>	<SLOUPEC PORADI="4">04</SLOUPEC>	<SLOUPEC PORADI="5">I</SLOUPEC>	<SLOUPEC PORADI="6">2013-08-01</SLOUPEC>	<SLOUPEC PORADI="7">00:00:37</SLOUPEC>	<SLOUPEC PORADI="8">169356100O300000</SLOUPEC>	<SLOUPEC PORADI="10">7312190138</SLOUPEC>	<SLOUPEC PORADI="11">7312190138</SLOUPEC>	<SLOUPEC PORADI="13">TRBDCZP1XXX-EURUSD</SLOUPEC>	<SLOUPEC PORADI="14">B</SLOUPEC>	<SLOUPEC PORADI="18">0.30000</SLOUPEC>	<SLOUPEC PORADI="19">K</SLOUPEC>	<SLOUPEC PORADI="33">N</SLOUPEC>	<SLOUPEC PORADI="34">N</SLOUPEC>	<SLOUPEC PORADI="39">DIRECT</SLOUPEC>
</RADEK>																	
<RADEK PORADI="4">																	
	<SLOUPEC PORADI="1">130842000004</SLOUPEC>	<SLOUPEC PORADI="2">USD</SLOUPEC>	<SLOUPEC PORADI="3">04</SLOUPEC>	<SLOUPEC PORADI="4">04</SLOUPEC>	<SLOUPEC PORADI="5">I</SLOUPEC>	<SLOUPEC PORADI="6">2013-08-01</SLOUPEC>	<SLOUPEC PORADI="7">00:01:19</SLOUPEC>	<SLOUPEC PORADI="8">205631930C100000</SLOUPEC>	<SLOUPEC PORADI="10">8507193112</SLOUPEC>	<SLOUPEC PORADI="11">8507193112</SLOUPEC>	<SLOUPEC PORADI="13">TRBDCZP1XXX-EURUSD</SLOUPEC>	<SLOUPEC PORADI="14">B</SLOUPEC>	<SLOUPEC PORADI="18">0.10000</SLOUPEC>	<SLOUPEC PORADI="19">K</SLOUPEC>	<SLOUPEC PORADI="33">N</SLOUPEC>	<SLOUPEC PORADI="34">N</SLOUPEC>	<SLOUPEC PORADI="39">DIRECT</SLOUPEC>
</RADEK>																	
<RADEK PORADI="5">																	
	<SLOUPEC PORADI="1">130842000005</SLOUPEC>	<SLOUPEC PORADI="2">USD</SLOUPEC>	<SLOUPEC PORADI="3">04</SLOUPEC>	<SLOUPEC PORADI="4">04</SLOUPEC>	<SLOUPEC PORADI="5">I</SLOUPEC>	<SLOUPEC PORADI="6">2013-08-01</SLOUPEC>	<SLOUPEC PORADI="7">00:02:04</SLOUPEC>	<SLOUPEC PORADI="8">169338500C300000</SLOUPEC>	<SLOUPEC PORADI="10">8156254601</SLOUPEC>	<SLOUPEC PORADI="11">8156254601</SLOUPEC>	<SLOUPEC PORADI="13">TRBDCZP1XXX-EURUSD..</SLOUPEC>	<SLOUPEC PORADI="14">S</SLOUPEC>	<SLOUPEC PORADI="18">0.20000</SLOUPEC>	<SLOUPEC PORADI="19">K</SLOUPEC>	<SLOUPEC PORADI="33">N</SLOUPEC>	<SLOUPEC PORADI="34">N</SLOUPEC>	<SLOUPEC PORADI="39">DIRECT</SLOUPEC>
</RADEK>																	
<RADEK PORADI="6">																	
	<SLOUPEC PORADI="1">130842000006</SLOUPEC>	<SLOUPEC PORADI="2">USD</SLOUPEC>	<SLOUPEC PORADI="3">04</SLOUPEC>	<SLOUPEC PORADI="4">04</SLOUPEC>	<SLOUPEC PORADI="5">I</SLOUPEC>	<SLOUPEC PORADI="6">2013-08-01</SLOUPEC>	<SLOUPEC PORADI="7">00:02:07</SLOUPEC>	<SLOUPEC PORADI="8">169353700C300000</SLOUPEC>	<SLOUPEC PORADI="10">8156254601</SLOUPEC>	<SLOUPEC PORADI="11">8156254601</SLOUPEC>	<SLOUPEC PORADI="13">TRBDCZP1XXX-AUDUSD..</SLOUPEC>	<SLOUPEC PORADI="14">S</SLOUPEC>	<SLOUPEC PORADI="18">0.20000</SLOUPEC>	<SLOUPEC PORADI="19">K</SLOUPEC>	<SLOUPEC PORADI="33">N</SLOUPEC>	<SLOUPEC PORADI="34">N</SLOUPEC>	<SLOUPEC PORADI="39">DIRECT</SLOUPEC>
</RADEK>																	
<RADEK PORADI="7">																	
	<SLOUPEC PORADI="1">130842000007</SLOUPEC>	<SLOUPEC PORADI="2">USD</SLOUPEC>	<SLOUPEC PORADI="3">04</SLOUPEC>	<SLOUPEC PORADI="4">04</SLOUPEC>	<SLOUPEC PORADI="5">I</SLOUPEC>	<SLOUPEC PORADI="6">2013-08-01</SLOUPEC>	<SLOUPEC PORADI="7">00:02:15</SLOUPEC>	<SLOUPEC PORADI="8">205639430O100000</SLOUPEC>	<SLOUPEC PORADI="10">7409200458</SLOUPEC>	<SLOUPEC PORADI="11">7409200458</SLOUPEC>	<SLOUPEC PORADI="13">TRBDCZP1XXX-EURUSD</SLOUPEC>	<SLOUPEC PORADI="14">B</SLOUPEC>	<SLOUPEC PORADI="18">0.40000</SLOUPEC>	<SLOUPEC PORADI="19">K</SLOUPEC>	<SLOUPEC PORADI="33">N</SLOUPEC>	<SLOUPEC PORADI="34">N</SLOUPEC>	<SLOUPEC PORADI="39">DIRECT</SLOUPEC>
</RADEK>																	
<RADEK PORADI="8">																	
	<SLOUPEC PORADI="1">130842000008</SLOUPEC>	<SLOUPEC PORADI="2">AUD</SLOUPEC>	<SLOUPEC PORADI="3">04</SLOUPEC>	<SLOUPEC PORADI="4">04</SLOUPEC>	<SLOUPEC PORADI="5">I</SLOUPEC>	<SLOUPEC PORADI="6">2013-08-01</SLOUPEC>	<SLOUPEC PORADI="7">00:02:27</SLOUPEC>	<SLOUPEC PORADI="8">169343800C300000</SLOUPEC>	<SLOUPEC PORADI="10">7801214773</SLOUPEC>	<SLOUPEC PORADI="11">7801214773</SLOUPEC>	<SLOUPEC PORADI="13">TRBDCZP1XXX-EURAUD..</SLOUPEC>	<SLOUPEC PORADI="14">B</SLOUPEC>	<SLOUPEC PORADI="18">1.00000</SLOUPEC>	<SLOUPEC PORADI="19">K</SLOUPEC>	<SLOUPEC PORADI="33">N</SLOUPEC>	<SLOUPEC PORADI="34">N</SLOUPEC>	<SLOUPEC PORADI="39">DIRECT</SLOUPEC>
</RADEK>																	
<RADEK PORADI="9">																	
	<SLOUPEC PORADI="1">130842000009</SLOUPEC>	<SLOUPEC PORADI="2">USD</SLOUPEC>	<SLOUPEC PORADI="3">04</SLOUPEC>	<SLOUPEC PORADI="4">04</SLOUPEC>	<SLOUPEC PORADI="5">I</SLOUPEC>	<SLOUPEC PORADI="6">2013-08-01</SLOUPEC>	<SLOUPEC PORADI="7">00:03:01</SLOUPEC>	<SLOUPEC PORADI="8">169357700O300000</SLOUPEC>	<SLOUPEC PORADI="10">7312190138</SLOUPEC>	<SLOUPEC PORADI="11">7312190138</SLOUPEC>	<SLOUPEC PORADI="13">TRBDCZP1XXX-EURUSD</SLOUPEC>	<SLOUPEC PORADI="14">B</SLOUPEC>	<SLOUPEC PORADI="18">0.20000</SLOUPEC>	<SLOUPEC PORADI="19">K</SLOUPEC>	<SLOUPEC PORADI="33">N</SLOUPEC>	<SLOUPEC PORADI="34">N</SLOUPEC>	<SLOUPEC PORADI="39">DIRECT</SLOUPEC>
</RADEK>																	
<RADEK PORADI="10">																	
	<SLOUPEC PORADI="1">130842000010</SLOUPEC>	<SLOUPEC PORADI="2">JPY</SLOUPEC>	<SLOUPEC PORADI="3">04</SLOUPEC>	<SLOUPEC PORADI="4">04</SLOUPEC>	<SLOUPEC PORADI="5">I</SLOUPEC>	<SLOUPEC PORADI="6">2013-08-01</SLOUPEC>	<SLOUPEC PORADI="7">00:05:15</SLOUPEC>	<SLOUPEC PORADI="8">169359200O300000</SLOUPEC>	<SLOUPEC PORADI="10">7708232455</SLOUPEC>	<SLOUPEC PORADI="11">7708232455</SLOUPEC>	<SLOUPEC PORADI="13">TRBDCZP1XXX-EURJPY</SLOUPEC>	<SLOUPEC PORADI="14">S</SLOUPEC>	<SLOUPEC PORADI="18">0.15000</SLOUPEC>	<SLOUPEC PORADI="19">K</SLOUPEC>	<SLOUPEC PORADI="33">N</SLOUPEC>	<SLOUPEC PORADI="34">N</SLOUPEC>	<SLOUPEC PORADI="39">DIRECT</SLOUPEC>
</RADEK>																	
		</DATOVA-OBLAST>
	</DATA>
</VYDANI>
